<?xml version="1.0" encoding="UTF-8"?>
<definition xmlns="http://www.xmlportletfactory.org/xml/xmlportletfactory" xmlns:xsi="http://www.w3.org/2001/XMLSchema-instance" xsi:schemaLocation="http://www.xmlportletfactory.org/xml/xmlportletfactory xmlportletfactory.xsd">
	<commonData>
        <client>org.xmlpf</client>
		<projectName>SchoolCoursesSample</projectName>
        <version>1</version>
        
	</commonData>
	<applications>
		<application>
			<classDef>
				<showInControlPanel>true</showInControlPanel>
				<name>Course</name>
				<title>Course</title>
				<mode>
					<add>true</add>
					<delete>true</delete>
					<modify>true</modify>
					<browse>true</browse>
				</mode>
			</classDef>
			<fileDef>
				<name>course</name>
				<fields>
					<field>
						<name>courseId</name>
						<title>Id</title>
						<type>
							<long>
								<length>5</length>
								<signed>false</signed>
								<nullable>false</nullable>
								<order>true</order>
							</long>
						</type>
						<showFieldInView>true</showFieldInView>
						<required>true</required>
					</field>
					<field>
						<name>courseName</name>
						<title>Course Name</title>
						<type>
							<varchar>
								<length>30</length>	
								<filter>true</filter>
								<order>true</order>
							</varchar>
						</type>
						<showFieldInView>true</showFieldInView>
						<required>true</required>
					</field>
					<field>
						<name>courseActive</name>
						<title>Is Active</title>
						<type>
							<boolean></boolean>
						</type>
						<showFieldInView>true</showFieldInView>
						<required>false</required>
					</field>
				</fields>
			</fileDef>
			<detailFiles>
				<detailFile>
					<connectionFieldName>courseId</connectionFieldName>
					<connectionTitle>Student - Course</connectionTitle>
					<detailFileClassName>Student</detailFileClassName>
				</detailFile>
				<detailFile>
					<connectionFieldName>courseId</connectionFieldName>
					<connectionTitle>Holidays - Course</connectionTitle>
					<detailFileClassName>Holiday</detailFileClassName>
				</detailFile>
				<detailFile>
					<connectionFieldName>courseId</connectionFieldName>
					<connectionTitle>CourseSubjects - Course</connectionTitle>
					<detailFileClassName>CourseSubjects</detailFileClassName>
				</detailFile>
			</detailFiles>			
		</application>

		<application>
			<classDef>
				<showInControlPanel>true</showInControlPanel>
				<name>Student</name>
				<title>Student</title>
				<mode>
					<add>true</add>
					<delete>true</delete>
					<modify>true</modify>
					<browse>true</browse>
				</mode>
			</classDef>
			<fileDef>
				<name>student</name>
				<fields>
					<field>
						<name>studentId</name>
						<title>Id</title>
						<type>
							<long>
								<length>5</length>
								<signed>false</signed>
								<nullable>false</nullable>
								<order>true</order>
							</long>
						</type>
						<showFieldInView>true</showFieldInView>
						<required>true</required>
					</field>
					<field>
						<name>courseId</name>
						<title>Course Id</title>
						<type>
							<long>
								<length>5</length>
								<signed>false</signed>
								<nullable>false</nullable>
								<order>true</order>
							</long>
						</type>
						<showFieldInView>false</showFieldInView>
						<required>true</required>
					</field>
					<field>
						<name>studentName</name>
						<title>Name</title>
						<type>
							<varchar>
								<length>30</length>	
								<filter>true</filter>
								<order>true</order>
							</varchar>
						</type>
						<showFieldInView>true</showFieldInView>
						<required>true</required>
					</field>
					<field>
						<name>classroomId</name>
						<title>Classroom</title>
						<type>
							<long>
								<length>5</length>
								<signed>false</signed>
								<nullable>false</nullable>
								<order>true</order>
							</long>
						</type>
						<showFieldInView>false</showFieldInView>
						<required>true</required>
						<validation>
							<className>Classrooms</className>
							<fieldName>classroomId</fieldName>
							<orderByField>classroomName</orderByField>
						</validation>            
					</field>
					<field>
						<name>studentPhoto</name>
						<title>Photo</title>
						<type>
							<document></document>
						</type>
						<showFieldInView>true</showFieldInView>
						<required>false</required>
					</field>
				</fields>
			</fileDef>
			<detailFiles>
				<detailFile>
					<connectionFieldName>studentId</connectionFieldName>
					<connectionTitle>Comments - Student</connectionTitle>
					<detailFileClassName>Comments</detailFileClassName>
				</detailFile>
			</detailFiles>			
		</application>
		
		<application>
			<classDef>
				<showInControlPanel>true</showInControlPanel>
				<name>Classroom</name>
				<title>Classroom</title>
				<mode>
					<add>true</add>
					<delete>true</delete>
					<modify>true</modify>
					<browse>true</browse>
				</mode>
			</classDef>
			<fileDef>
				<name>classroom</name>
				<fields>
					<field>
						<name>classroomId</name>
						<title>Id</title>
						<type>
							<long>
								<length>5</length>
								<signed>false</signed>
								<nullable>false</nullable>
								<order>true</order>
							</long>
						</type>
						<showFieldInView>true</showFieldInView>
						<required>true</required>
					</field>
					<field>
						<name>classroomName</name>
						<title>Name</title>
						<type>
							<varchar>
								<length>30</length>	
								<filter>true</filter>
								<order>true</order>
							</varchar>
						</type>
						<showFieldInView>true</showFieldInView>
						<required>true</required>
					</field>
				</fields>
			</fileDef>
		</application>

		<application>
			<classDef>
				<showInControlPanel>true</showInControlPanel>
				<name>StudentComment</name>
				<title>Student Comment</title>
				<mode>
					<add>true</add>
					<delete>true</delete>
					<modify>true</modify>
					<browse>true</browse>
				</mode>
			</classDef>
			<fileDef>
				<name>comment</name>
				<fields>
					<field>
						<name>commentId</name>
						<title>Comment Id</title>
						<type>
							<long>
								<length>5</length>
								<signed>false</signed>
								<nullable>false</nullable>
								<order>true</order>
							</long>
						</type>
						<showFieldInView>true</showFieldInView>
						<required>true</required>
					</field>
					<field>
						<name>studentId</name>
						<title>Student Id</title>
						<type>
							<long>
								<length>5</length>
								<signed>false</signed>
								<nullable>false</nullable>
								<order>true</order>
							</long>
						</type>
						<showFieldInView>false</showFieldInView>
						<required>true</required>
					</field>
					<field>
						<name>comment</name>
						<title>Comment</title>
						<type>
							<text></text>
						</type>
						<showFieldInView>true</showFieldInView>
						<required>false</required>
					</field>
				</fields>
			</fileDef>
		</application>		
		
		<application>
			<classDef>
				<showInControlPanel>true</showInControlPanel>
				<name>CourseSubject</name>
				<title>Course Subject</title>
				<mode>
					<add>true</add>
					<delete>true</delete>
					<modify>true</modify>
					<browse>true</browse>
				</mode>
			</classDef>
			<fileDef>
				<name>courseSubject</name>
				<fields>
					<field>
						<name>courseSubjectId</name>
						<title>Course Subject Id</title>
						<type>
							<long>
								<length>5</length>
								<signed>false</signed>
								<nullable>false</nullable>
								<order>true</order>
							</long>
						</type>
						<showFieldInView>true</showFieldInView>
						<required>true</required>
					</field>
					<field>
						<name>courseId</name>
						<title>Course Id</title>
						<type>
							<long>
								<length>5</length>
								<signed>false</signed>
								<nullable>false</nullable>
								<order>true</order>
							</long>
						</type>
						<showFieldInView>false</showFieldInView>
						<required>true</required>
					</field>
					<field>
						<name>subjectId</name>
						<title>Subject Id</title>
						<type>
							<long>
								<length>5</length>
								<signed>false</signed>
								<nullable>false</nullable>
								<order>true</order>
							</long>
						</type>
						<validation>
							<className>Subjects</className>
							<fieldName>subjectId</fieldName>
							<orderByField>subjectName</orderByField>
						</validation>
						<showFieldInView>true</showFieldInView>
						<required>true</required>
					</field>
					<field>
						<name>teacherId</name>
						<title>Teacher Id</title>
						<type>
							<long>
								<length>5</length>
								<signed>false</signed>
								<nullable>false</nullable>
								<order>true</order>
							</long>
						</type>
						<validation>
							<className>Teachers</className>
							<fieldName>teacherId</fieldName>
							<orderByField>teacherName</orderByField>
						</validation>
						<showFieldInView>true</showFieldInView>
						<required>true</required>
					</field>
				</fields>
			</fileDef>
		</application>
		
		<application>
			<classDef>
				<showInControlPanel>true</showInControlPanel>
				<name>Subject</name>
				<title>Subject</title>
				<mode>
					<add>true</add>
					<delete>true</delete>
					<modify>true</modify>
					<browse>true</browse>
				</mode>
			</classDef>
			<fileDef>
				<name>subject</name>
				<fields>
					<field>
						<name>subjectId</name>
						<title>Subject Id</title>
						<type>
							<long>
								<length>5</length>
								<signed>false</signed>